{
  "schema_version": "1.0",
  "product_version": "1.0.0",
  "status": "APPROVED",
  "last_approved_at": "2026-09-01",
  "approved_by": "user",
  "sections": [
    {
      "order": 1,
      "id": "SEC-01",
      "name": "顶部导航",
      "data_source": "static"
    },
    {
      "order": 2,
      "id": "SEC-02",
      "name": "Hero（定位+CTA+版本徽标）",
      "data_source": "release_metadata"
    },
    {
      "order": 3,
      "id": "SEC-03",
      "name": "核心 BLE 闭环图",
      "data_source": "static"
    },
    {
      "order": 4,
      "id": "SEC-04",
      "name": "能力卡矩阵（带状态徽标）",
      "data_source": "release_metadata"
    },
    {
      "order": 5,
      "id": "SEC-05",
      "name": "平台状态表",
      "anchor": "#platforms",
      "data_source": "release_metadata"
    },
    {
      "order": 6,
      "id": "SEC-06",
      "name": "真实 App 截图组",
      "data_source": "build_artifacts"
    },
    {
      "order": 7,
      "id": "SEC-07",
      "name": "在线交互原型入口",
      "data_source": "build_artifacts"
    },
    {
      "order": 8,
      "id": "SEC-08",
      "name": "ESP32 Peripheral/Observer 双卡",
      "anchor": "#esp32",
      "data_source": "release_metadata"
    },
    {
      "order": 9,
      "id": "SEC-09",
      "name": "快速开始（三条 5 分钟 Quick Start + 30 分钟 Clean Machine 入口，前置条件显式标注）",
      "anchor": "#quickstart",
      "data_source": "static"
    },
    {
      "order": 10,
      "id": "SEC-10",
      "name": "下载区（APK/小程序码/固件）",
      "anchor": "#download",
      "data_source": "release_metadata"
    },
    {
      "order": 11,
      "id": "SEC-11",
      "name": "证据与已知限制",
      "anchor": "#evidence",
      "data_source": "evidence_index"
    },
    {
      "order": 12,
      "id": "SEC-12",
      "name": "Smart HID 区",
      "anchor": "#smart-hid",
      "data_source": "release_metadata"
    },
    {
      "order": 13,
      "id": "SEC-13",
      "name": "开源与贡献",
      "data_source": "static"
    },
    {
      "order": 14,
      "id": "SEC-14",
      "name": "页脚（版权/License/隐私/站点地图）",
      "data_source": "static"
    }
  ],
  "claims": [
    {
      "id": "CLAIM-001",
      "statement": "产品定位一句话（Hero）",
      "evidence_prerequisite": "与 01 号文档一致",
      "tests": [
        "TEST-R-006"
      ]
    },
    {
      "id": "CLAIM-002",
      "statement": "当前版本与渠道（Hero 徽标）",
      "evidence_prerequisite": "Release Metadata",
      "tests": [
        "TEST-R-002"
      ]
    },
    {
      "id": "CLAIM-003",
      "statement": "核心闭环七环节",
      "evidence_prerequisite": "各环节达标",
      "tests": [
        "TEST-R-007"
      ]
    },
    {
      "id": "CLAIM-004",
      "statement": "扫描与广播解析",
      "evidence_prerequisite": "E5 双平台+夹具",
      "tests": [
        "TEST-A-005",
        "TEST-E-001"
      ],
      "allowed_status": "VERIFIED"
    },
    {
      "id": "CLAIM-005",
      "statement": "两轮扫描与筛选",
      "evidence_prerequisite": "E5",
      "tests": [
        "TEST-A-005"
      ],
      "allowed_status": "VERIFIED"
    },
    {
      "id": "CLAIM-006",
      "statement": "连接与 GATT 读写/订阅",
      "evidence_prerequisite": "E5",
      "tests": [
        "TEST-A-006",
        "TEST-A-008",
        "TEST-E-003"
      ],
      "allowed_status": "VERIFIED"
    },
    {
      "id": "CLAIM-007",
      "statement": "属性/权限组合教学服务",
      "evidence_prerequisite": "E5",
      "tests": [
        "TEST-E-003"
      ],
      "allowed_status": "VERIFIED"
    },
    {
      "id": "CLAIM-008",
      "statement": "按设备通信日志与导出",
      "evidence_prerequisite": "E5",
      "tests": [
        "TEST-A-008"
      ],
      "allowed_status": "VERIFIED"
    },
    {
      "id": "CLAIM-009",
      "statement": "多设备会话管理",
      "evidence_prerequisite": "E5",
      "tests": [
        "TEST-A-009"
      ],
      "allowed_status": "VERIFIED"
    },
    {
      "id": "CLAIM-010",
      "statement": "OTA 完整事务+版本回读",
      "evidence_prerequisite": "TEST-E-007 与 A/W 对应全过（否则 BLOCKED，DEC-001）",
      "tests": [
        "TEST-E-007",
        "TEST-A-011"
      ],
      "allowed_status": "VERIFIED"
    },
    {
      "id": "CLAIM-011",
      "statement": "手机广播+Observer 验证",
      "evidence_prerequisite": "E5 Observer",
      "tests": [
        "TEST-E-006",
        "TEST-A-010"
      ],
      "allowed_status": "VERIFIED"
    },
    {
      "id": "CLAIM-012",
      "statement": "版本透明（五处一致）",
      "evidence_prerequisite": "TEST-C-006",
      "tests": [
        "TEST-C-006",
        "TEST-R-002"
      ]
    },
    {
      "id": "CLAIM-013",
      "statement": "平台状态表",
      "evidence_prerequisite": "08 号矩阵投影",
      "tests": [
        "TEST-R-003"
      ]
    },
    {
      "id": "CLAIM-014",
      "statement": "Smart HID 配网/诊断",
      "evidence_prerequisite": "TEST-H 全过（DEC-006）",
      "tests": [
        "TEST-H-001",
        "TEST-H-002",
        "TEST-H-003",
        "TEST-H-004",
        "TEST-H-005",
        "TEST-H-006"
      ],
      "allowed_status": "PREVIEW"
    },
    {
      "id": "CLAIM-015",
      "statement": "开源 MIT 与源码可得",
      "evidence_prerequisite": "仓库/License",
      "tests": [
        "TEST-R-005"
      ]
    },
    {
      "id": "CLAIM-016",
      "statement": "ESP32 双模式夹具",
      "evidence_prerequisite": "固件可下载可复现",
      "tests": [
        "TEST-E-008",
        "TEST-R-008"
      ]
    },
    {
      "id": "CLAIM-017",
      "statement": "两条 5 分钟快速开始（Android / ESP32；Quick Start：前置条件已满足，不含工具链从零安装，19 号文档 2.1 节）",
      "evidence_prerequisite": "教程实测",
      "tests": [
        "TEST-R-005"
      ]
    },
    {
      "id": "CLAIM-018",
      "statement": "下载含 SHA 与设备清单",
      "evidence_prerequisite": "Metadata",
      "tests": [
        "TEST-R-001",
        "TEST-R-008"
      ]
    },
    {
      "id": "CLAIM-019",
      "statement": "已知限制公开",
      "evidence_prerequisite": "Metadata",
      "tests": [
        "TEST-R-003"
      ]
    },
    {
      "id": "CLAIM-020",
      "statement": "证据可查（EVID 链接）",
      "evidence_prerequisite": "证据存在",
      "tests": [
        "TEST-R-007"
      ]
    },
    {
      "id": "CLAIM-021",
      "statement": "隐私立场（本地优先无云端）",
      "evidence_prerequisite": "SEC-008",
      "tests": [
        "TEST-R-003"
      ]
    },
    {
      "id": "CLAIM-022",
      "statement": "安全披露渠道",
      "evidence_prerequisite": "SECURITY.md",
      "tests": [
        "TEST-R-005"
      ]
    },
    {
      "id": "CLAIM-023",
      "statement": "在线交互原型",
      "evidence_prerequisite": "原型部署",
      "tests": [
        "TEST-R-006"
      ]
    },
    {
      "id": "CLAIM-024",
      "statement": "真实 App 截图",
      "evidence_prerequisite": "截图存在+alt",
      "tests": [
        "TEST-R-006"
      ]
    },
    {
      "id": "CLAIM-025",
      "statement": "贡献指南与 Profile 扩展",
      "evidence_prerequisite": "文档存在",
      "tests": [
        "TEST-R-005"
      ]
    },
    {
      "id": "CLAIM-026",
      "statement": "无 JS 可读核心内容",
      "evidence_prerequisite": "SSG",
      "tests": [
        "TEST-R-006"
      ]
    },
    {
      "id": "CLAIM-028",
      "statement": "Android APK 下载",
      "evidence_prerequisite": "产物+SHA",
      "tests": [
        "TEST-R-001"
      ]
    },
    {
      "id": "CLAIM-029",
      "statement": "SEO/OG/canonical 正确",
      "evidence_prerequisite": "抓取一致",
      "tests": [
        "TEST-R-006"
      ]
    },
    {
      "id": "CLAIM-030",
      "statement": "无障碍承诺（对比度/键盘/alt）",
      "evidence_prerequisite": "a11y 走查",
      "tests": [
        "TEST-R-010"
      ]
    },
    {
      "id": "CLAIM-031",
      "statement": "新电脑 30 分钟 Clean Machine 端到端闭环（clone→依赖→build→flash→install→scan→connect→write→notify，19 号文档 2.2 节；与 CLAIM-017 Quick Start 使用不同测试 ID，不得互相冒充）",
      "evidence_prerequisite": "独立电脑全流程录屏",
      "tests": [
        "TEST-R-011"
      ]
    }
  ],
  "download_rules": {
    "no_fake_download": true,
    "sha_required": true,
    "artifact_kinds": [
      "apk",
      "firmware-peripheral",
      "firmware-observer"
    ],
    "missing_artifact_behavior": "无产物=NOT_RELEASED 说明卡，不出现下载链接（STATE-W001-03）",
    "apk_source_constraint": "APK 必须为 UniApp Android 正式构建产物；下载卡与产物 kind 一一对应，禁止指向其他客户端产物"
  },
  "qr_rules": {
    "official_only": true,
    "pre_release_scan_test": true,
    "text_equivalent_required": true
  },
  "degradation": {
    "states": [
      "STATE-W001-01 VERIFIED 发布态",
      "STATE-W001-02 PREVIEW 证据前态",
      "STATE-W001-03 NOT_RELEASED 无产物",
      "STATE-W001-04 资源缺失降级"
    ],
    "no_js_core_content": true
  },
  "seo_a11y": {
    "canonical_consistent": true,
    "contrast_min": "正文 ≥4.5:1（亮暗两套主题）",
    "keyboard_navigable": true,
    "alt_required": true,
    "lcp_target": "≤2.5s；页面总重 ≤2MB",
    "dark_mode": true,
    "forbidden_positioning": [
      "多端大一统",
      "跨平台低功耗蓝牙大一统开发库",
      "6+ 运行入口等无证据数字"
    ]
  },
  "planned_tests": [
    "TEST-R-001",
    "TEST-R-002",
    "TEST-R-003",
    "TEST-R-004",
    "TEST-R-005",
    "TEST-R-006",
    "TEST-R-007",
    "TEST-R-008",
    "TEST-R-009",
    "TEST-R-010",
    "TEST-R-011"
  ],
  "minimum_evidence_level": "E6",
  "release_blocking": true
}
